{
  "name": "dbth Ward",
  "lineageTag": "40987abf-f635-427f-810d-e30a2fb64430",
  "columns": [
    {
      "name": "SYSSourceSystem",
      "dataType": "string",
      "sourceColumn": "SYSSourceSystem",
      "lineageTag": "5575fad1-cf36-44f1-8368-a64968852d2d",
      "summarizeBy": "none",
      "annotations": [
        {
          "name": "SummarizationSetBy",
          "value": "Automatic"
        },
        {
          "name": "Format",
          "value": "<Format Format=\"Text\" />"
        }
      ]
    },
    {
      "name": "AgeGroupIntendedCode",
      "dataType": "int64",
      "sourceColumn": "AgeGroupIntendedCode",
      "lineageTag": "bf8dadb7-b256-4167-b4d7-7db766d3fe51",
      "summarizeBy": "none",
      "annotations": [
        {
          "name": "SummarizationSetBy",
          "value": "Automatic"
        },
        {
          "name": "Format",
          "value": "<Format Format=\"General\" />"
        }
      ]
    },
    {
      "name": "AvailableCountDays",
      "dataType": "double",
      "sourceColumn": "AvailableCountDays",
      "lineageTag": "71c367fc-2704-4d06-a81e-3dde72044008",
      "summarizeBy": "sum",
      "annotations": [
        {
          "name": "SummarizationSetBy",
          "value": "Automatic"
        },
        {
          "name": "Format",
          "value": "<Format Format=\"General\" />"
        }
      ]
    },
    {
      "name": "AvailableCountNights",
      "dataType": "double",
      "sourceColumn": "AvailableCountNights",
      "lineageTag": "24e17990-aa3f-4891-947f-4a263be766bd",
      "summarizeBy": "sum",
      "annotations": [
        {
          "name": "SummarizationSetBy",
          "value": "Automatic"
        },
        {
          "name": "Format",
          "value": "<Format Format=\"General\" />"
        }
      ]
    },
    {
      "name": "BedCountNurse",
      "dataType": "double",
      "sourceColumn": "BedCountNurse",
      "lineageTag": "0a357a3f-2439-4c33-924b-1986ec552859",
      "summarizeBy": "sum",
      "annotations": [
        {
          "name": "SummarizationSetBy",
          "value": "Automatic"
        },
        {
          "name": "Format",
          "value": "<Format Format=\"General\" />"
        }
      ]
    },
    {
      "name": "BedCountConsultant",
      "dataType": "double",
      "sourceColumn": "BedCountConsultant",
      "lineageTag": "5fd7907c-e5fc-416a-92ec-50bcc1a39f3d",
      "summarizeBy": "sum",
      "annotations": [
        {
          "name": "SummarizationSetBy",
          "value": "Automatic"
        },
        {
          "name": "Format",
          "value": "<Format Format=\"General\" />"
        }
      ]
    },
    {
      "name": "DateFrom",
      "dataType": "dateTime",
      "sourceColumn": "DateFrom",
      "formatString": "General Date",
      "lineageTag": "8760674a-5fdd-418c-9235-e8c7eff24acd",
      "summarizeBy": "none",
      "annotations": [
        {
          "name": "SummarizationSetBy",
          "value": "Automatic"
        },
        {
          "name": "Format",
          "value": "<Format Format=\"DateTimeGeneralPattern\"><DateTimes><DateTime LCID=\"1033\" Group=\"GeneralDateTimeLong\" FormatString=\"G\" /></DateTimes></Format>"
        }
      ]
    },
    {
      "name": "DateTo",
      "dataType": "string",
      "sourceColumn": "DateTo",
      "lineageTag": "2ea575ad-003c-4476-b591-fa7499027a0b",
      "summarizeBy": "none",
      "annotations": [
        {
          "name": "SummarizationSetBy",
          "value": "Automatic"
        },
        {
          "name": "Format",
          "value": "<Format Format=\"Text\" />"
        }
      ]
    },
    {
      "name": "DayNightAvailabilityDescription",
      "dataType": "string",
      "sourceColumn": "DayNightAvailabilityDescription",
      "lineageTag": "93612d13-59bc-468f-8a6a-810ca7d3e1ad",
      "summarizeBy": "none",
      "annotations": [
        {
          "name": "SummarizationSetBy",
          "value": "Automatic"
        },
        {
          "name": "Format",
          "value": "<Format Format=\"Text\" />"
        }
      ]
    },
    {
      "name": "SexGroupDescription",
      "dataType": "string",
      "sourceColumn": "SexGroupDescription",
      "lineageTag": "dffbf3ad-230e-4a86-94f3-a1b83eca1c6d",
      "summarizeBy": "none",
      "annotations": [
        {
          "name": "SummarizationSetBy",
          "value": "Automatic"
        },
        {
          "name": "Format",
          "value": "<Format Format=\"Text\" />"
        }
      ]
    },
    {
      "name": "SexOfPatientsCode",
      "dataType": "double",
      "sourceColumn": "SexOfPatientsCode",
      "lineageTag": "8ac2778e-fb96-4aaa-8ede-62fc19508e56",
      "summarizeBy": "count",
      "annotations": [
        {
          "name": "SummarizationSetBy",
          "value": "Automatic"
        },
        {
          "name": "Format",
          "value": "<Format Format=\"General\" />"
        }
      ]
    },
    {
      "name": "SMTWTFSAvailabilityMatrixDay",
      "dataType": "string",
      "sourceColumn": "SMTWTFSAvailabilityMatrixDay",
      "lineageTag": "06933504-6832-413e-b31e-4125adbffcc8",
      "summarizeBy": "none",
      "annotations": [
        {
          "name": "SummarizationSetBy",
          "value": "Automatic"
        },
        {
          "name": "Format",
          "value": "<Format Format=\"Text\" />"
        }
      ]
    },
    {
      "name": "SMTWTFSAvailabilityMatrixNight",
      "dataType": "string",
      "sourceColumn": "SMTWTFSAvailabilityMatrixNight",
      "lineageTag": "2bfb0e88-e0bd-4313-9132-62d200287864",
      "summarizeBy": "none",
      "annotations": [
        {
          "name": "SummarizationSetBy",
          "value": "Automatic"
        },
        {
          "name": "Format",
          "value": "<Format Format=\"Text\" />"
        }
      ]
    },
    {
      "name": "WardCode",
      "dataType": "string",
      "sourceColumn": "WardCode",
      "lineageTag": "bdd13c5d-f8ea-4b7c-bbd9-404fd1bf6c1c",
      "summarizeBy": "none",
      "annotations": [
        {
          "name": "SummarizationSetBy",
          "value": "Automatic"
        },
        {
          "name": "Format",
          "value": "<Format Format=\"Text\" />"
        }
      ]
    },
    {
      "name": "WardName",
      "dataType": "string",
      "sourceColumn": "WardName",
      "lineageTag": "668f8e53-5eaf-4a99-ba25-fdfcdf899aec",
      "summarizeBy": "none",
      "annotations": [
        {
          "name": "SummarizationSetBy",
          "value": "Automatic"
        },
        {
          "name": "Format",
          "value": "<Format Format=\"Text\" />"
        }
      ]
    },
    {
      "name": "HospitalCode",
      "dataType": "string",
      "sourceColumn": "HospitalCode",
      "lineageTag": "818b8022-75f9-4d70-ad8c-6b7c7e3ebee8",
      "summarizeBy": "none",
      "annotations": [
        {
          "name": "SummarizationSetBy",
          "value": "Automatic"
        },
        {
          "name": "Format",
          "value": "<Format Format=\"Text\" />"
        }
      ]
    },
    {
      "name": "IntendedClinicalCareIntensityCode",
      "dataType": "int64",
      "sourceColumn": "IntendedClinicalCareIntensityCode",
      "formatString": "0",
      "lineageTag": "0a5c112b-5a73-4660-b0e4-166cfb50f5ac",
      "summarizeBy": "none",
      "annotations": [
        {
          "name": "SummarizationSetBy",
          "value": "Automatic"
        },
        {
          "name": "Format",
          "value": "<Format Format=\"NumberWhole\" Accuracy=\"0\" />"
        }
      ]
    },
    {
      "name": "Type",
      "dataType": "string",
      "sourceColumn": "Type",
      "lineageTag": "7eec76f2-0b2b-4a1c-a9f4-563317e831b1",
      "summarizeBy": "none",
      "annotations": [
        {
          "name": "SummarizationSetBy",
          "value": "Automatic"
        },
        {
          "name": "Format",
          "value": "<Format Format=\"Text\" />"
        }
      ]
    },
    {
      "name": "Kind",
      "dataType": "string",
      "sourceColumn": "Kind",
      "lineageTag": "42eb5f5a-a640-4a4d-96a0-0ce7638d98c3",
      "summarizeBy": "none",
      "annotations": [
        {
          "name": "SummarizationSetBy",
          "value": "Automatic"
        },
        {
          "name": "Format",
          "value": "<Format Format=\"Text\" />"
        }
      ]
    },
    {
      "type": "calculated",
      "name": "TypeKind",
      "dataType": "string",
      "isDataTypeInferred": true,
      "expression": "{ref: ColumnExpressions\\TypeKind.dax}",
      "lineageTag": "ad0fd5a6-eb68-480a-b5b3-566e652ebc53",
      "summarizeBy": "none",
      "annotations": [
        {
          "name": "SummarizationSetBy",
          "value": "Automatic"
        },
        {
          "name": "Format",
          "value": "<Format Format=\"Text\" />"
        }
      ]
    }
  ],
  "partitions": [
    {
      "name": "dbth Ward-bc249986-19fd-42ec-a9c3-c1a4944735c3",
      "mode": "import",
      "source": {
        "type": "m",
        "expression": "{ref: PartitionExpressions\\dbth Ward-bc249986-19fd-42ec-a9c3-c1a4944735c3.m}"
      }
    }
  ],
  "annotations": [
    {
      "name": "PBI_ResultType",
      "value": "Table"
    }
  ]
}