{
  "name": "dbth Episode",
  "lineageTag": "f43c0c29-edee-4a65-a08c-2af66516b3d0",
  "columns": [
    {
      "name": "Id",
      "dataType": "int64",
      "sourceColumn": "Id",
      "formatString": "0",
      "lineageTag": "aa9ff904-f466-4dd4-a4cc-6c332749f412",
      "summarizeBy": "count",
      "annotations": [
        {
          "name": "SummarizationSetBy",
          "value": "Automatic"
        },
        {
          "name": "Format",
          "value": "<Format Format=\"NumberWhole\" Accuracy=\"0\" />"
        },
        {
          "name": "DataTypeAtRefresh",
          "value": "Int64#####not a type"
        },
        {
          "name": "PBI_NameAtRefresh",
          "value": "Id"
        },
        {
          "name": "PBI_WasHiddenAtRefresh",
          "value": "False"
        }
      ]
    },
    {
      "name": "SpellId",
      "dataType": "int64",
      "sourceColumn": "SpellId",
      "formatString": "0",
      "lineageTag": "2d3ca61a-ef9d-4c44-a37e-5c70b8e6d669",
      "summarizeBy": "none",
      "annotations": [
        {
          "name": "SummarizationSetBy",
          "value": "Automatic"
        },
        {
          "name": "Format",
          "value": "<Format Format=\"NumberWhole\" Accuracy=\"0\" />"
        },
        {
          "name": "DataTypeAtRefresh",
          "value": "Int64#####not a type"
        },
        {
          "name": "PBI_NameAtRefresh",
          "value": "SpellId"
        },
        {
          "name": "PBI_WasHiddenAtRefresh",
          "value": "False"
        }
      ]
    },
    {
      "name": "SourceSystem",
      "dataType": "string",
      "sourceColumn": "SourceSystem",
      "lineageTag": "fc8eb5b7-2714-4a13-832f-ae1050acb0aa",
      "summarizeBy": "none",
      "annotations": [
        {
          "name": "SummarizationSetBy",
          "value": "Automatic"
        },
        {
          "name": "Format",
          "value": "<Format Format=\"Text\" />"
        },
        {
          "name": "DataTypeAtRefresh",
          "value": "String#####not a type"
        },
        {
          "name": "PBI_NameAtRefresh",
          "value": "SourceSystem"
        },
        {
          "name": "PBI_WasHiddenAtRefresh",
          "value": "False"
        }
      ]
    },
    {
      "name": "ConsultantMainSpecialty",
      "dataType": "int64",
      "sourceColumn": "ConsultantMainSpecialty",
      "formatString": "0",
      "lineageTag": "64b2cb33-2726-493e-9a0a-8c3d16958e2b",
      "summarizeBy": "none",
      "annotations": [
        {
          "name": "SummarizationSetBy",
          "value": "Automatic"
        },
        {
          "name": "Format",
          "value": "<Format Format=\"NumberWhole\" Accuracy=\"0\" />"
        },
        {
          "name": "DataTypeAtRefresh",
          "value": "Int64#####not a type"
        },
        {
          "name": "PBI_NameAtRefresh",
          "value": "ConsultantMainSpecialty"
        },
        {
          "name": "PBI_WasHiddenAtRefresh",
          "value": "False"
        }
      ]
    },
    {
      "name": "Start",
      "dataType": "dateTime",
      "sourceColumn": "Start",
      "formatString": "General Date",
      "lineageTag": "9570a4e1-78fa-4460-9ee9-298e8da24f99",
      "summarizeBy": "none",
      "annotations": [
        {
          "name": "SummarizationSetBy",
          "value": "Automatic"
        },
        {
          "name": "Format",
          "value": "<Format Format=\"DateTimeGeneralPattern\"><DateTimes><DateTime LCID=\"1033\" Group=\"GeneralDateTimeLong\" FormatString=\"G\" /></DateTimes></Format>"
        },
        {
          "name": "DataTypeAtRefresh",
          "value": "DateTime#####not a type"
        },
        {
          "name": "PBI_NameAtRefresh",
          "value": "Start"
        },
        {
          "name": "PBI_WasHiddenAtRefresh",
          "value": "False"
        }
      ]
    },
    {
      "name": "End",
      "dataType": "dateTime",
      "sourceColumn": "End",
      "formatString": "General Date",
      "lineageTag": "0c548bf5-3eb4-4e36-8d09-c975e2d4db85",
      "summarizeBy": "none",
      "annotations": [
        {
          "name": "SummarizationSetBy",
          "value": "Automatic"
        },
        {
          "name": "Format",
          "value": "<Format Format=\"DateTimeGeneralPattern\"><DateTimes><DateTime LCID=\"1033\" Group=\"GeneralDateTimeLong\" FormatString=\"G\" /></DateTimes></Format>"
        },
        {
          "name": "DataTypeAtRefresh",
          "value": "DateTime#####not a type"
        },
        {
          "name": "PBI_NameAtRefresh",
          "value": "End"
        },
        {
          "name": "PBI_WasHiddenAtRefresh",
          "value": "False"
        }
      ]
    },
    {
      "name": "Number",
      "dataType": "int64",
      "sourceColumn": "Number",
      "formatString": "0",
      "lineageTag": "26fece22-5cf7-486c-b736-3d57cf5b66a8",
      "summarizeBy": "sum",
      "annotations": [
        {
          "name": "SummarizationSetBy",
          "value": "Automatic"
        },
        {
          "name": "Format",
          "value": "<Format Format=\"NumberWhole\" Accuracy=\"0\" />"
        },
        {
          "name": "DataTypeAtRefresh",
          "value": "Int64#####not a type"
        },
        {
          "name": "PBI_NameAtRefresh",
          "value": "Number"
        },
        {
          "name": "PBI_WasHiddenAtRefresh",
          "value": "False"
        }
      ]
    },
    {
      "name": "CodingStatus",
      "dataType": "string",
      "sourceColumn": "CodingStatus",
      "lineageTag": "053f4691-a1d3-4619-aaab-e0ff0605c902",
      "summarizeBy": "none",
      "annotations": [
        {
          "name": "SummarizationSetBy",
          "value": "Automatic"
        },
        {
          "name": "Format",
          "value": "<Format Format=\"Text\" />"
        }
      ]
    },
    {
      "type": "calculated",
      "name": "DateStart",
      "dataType": "dateTime",
      "isDataTypeInferred": true,
      "expression": "{ref: ColumnExpressions\\DateStart.dax}",
      "formatString": "General Date",
      "lineageTag": "925b7d06-a1e4-428e-be75-dffb93efe140",
      "summarizeBy": "none",
      "annotations": [
        {
          "name": "SummarizationSetBy",
          "value": "Automatic"
        },
        {
          "name": "Format",
          "value": "<Format Format=\"DateTimeGeneralPattern\"><DateTimes><DateTime LCID=\"1033\" Group=\"GeneralDateTimeLong\" FormatString=\"G\" /></DateTimes></Format>"
        }
      ]
    },
    {
      "type": "calculated",
      "name": "DateEnd",
      "dataType": "dateTime",
      "isDataTypeInferred": true,
      "expression": "{ref: ColumnExpressions\\DateEnd.dax}",
      "formatString": "General Date",
      "lineageTag": "1ad13aad-1755-4c7a-a519-c70fcce4284a",
      "summarizeBy": "none",
      "annotations": [
        {
          "name": "SummarizationSetBy",
          "value": "Automatic"
        },
        {
          "name": "Format",
          "value": "<Format Format=\"DateTimeGeneralPattern\"><DateTimes><DateTime LCID=\"1033\" Group=\"GeneralDateTimeLong\" FormatString=\"G\" /></DateTimes></Format>"
        }
      ]
    }
  ],
  "partitions": [
    {
      "name": "dbth Episode-aac5c86b-2ba1-4fa7-9f6c-b4fef6c74871",
      "mode": "import",
      "source": {
        "type": "m",
        "expression": "{ref: PartitionExpressions\\dbth Episode-aac5c86b-2ba1-4fa7-9f6c-b4fef6c74871.m}"
      }
    }
  ],
  "measures": [
    {
      "name": "Episodes in perdiod",
      "expression": "{ref: MeasureExpressions\\Episodes in perdiod.dax}",
      "lineageTag": "75616879-f70b-40f5-ae17-755a8039daa8"
    },
    {
      "name": "Episode Days in period",
      "expression": "{ref: MeasureExpressions\\Episode Days in period.dax}",
      "formatString": "0",
      "lineageTag": "593cf6a4-ec93-4faf-b16a-6469277dd853",
      "annotations": [
        {
          "name": "Format",
          "value": "<Format Format=\"NumberWhole\" Accuracy=\"0\" />"
        }
      ]
    }
  ],
  "annotations": [
    {
      "name": "PBI_DescriptionAtRefresh"
    },
    {
      "name": "PBI_ResultType",
      "value": "Table"
    }
  ]
}