{
  "name": "dbth WardIntendedAgeGroup",
  "lineageTag": "9a3ccad7-1425-43d9-b696-1bd69559c70d",
  "columns": [
    {
      "name": "Code",
      "dataType": "int64",
      "sourceColumn": "Code",
      "formatString": "0",
      "lineageTag": "aac2f00b-4848-4e6e-b39a-124ec24c5e14",
      "summarizeBy": "none",
      "annotations": [
        {
          "name": "SummarizationSetBy",
          "value": "Automatic"
        },
        {
          "name": "Format",
          "value": "<Format Format=\"NumberWhole\" Accuracy=\"0\" />"
        }
      ]
    },
    {
      "name": "Description",
      "dataType": "string",
      "sourceColumn": "Description",
      "lineageTag": "7d60c36f-81ca-48a5-a45d-064881dad082",
      "summarizeBy": "none",
      "annotations": [
        {
          "name": "SummarizationSetBy",
          "value": "Automatic"
        },
        {
          "name": "Format",
          "value": "<Format Format=\"Text\" />"
        }
      ]
    }
  ],
  "partitions": [
    {
      "name": "dbth WardIntendedAgeGroup-a968774b-8c82-4bcc-9073-1e32c98176e3",
      "mode": "import",
      "source": {
        "type": "m",
        "expression": "{ref: PartitionExpressions\\dbth WardIntendedAgeGroup-a968774b-8c82-4bcc-9073-1e32c98176e3.m}"
      }
    }
  ],
  "annotations": [
    {
      "name": "PBI_ResultType",
      "value": "Table"
    }
  ]
}