{
  "name": "dbth AttendanceDisposal",
  "lineageTag": "5384e30e-25dd-4ecb-b03e-7dc1d3d980bc",
  "columns": [
    {
      "name": "Code",
      "dataType": "int64",
      "sourceColumn": "Code",
      "formatString": "0",
      "lineageTag": "bee20967-0cb1-427d-9819-12509fdfc0bb",
      "summarizeBy": "none",
      "annotations": [
        {
          "name": "SummarizationSetBy",
          "value": "Automatic"
        },
        {
          "name": "Format",
          "value": "<Format Format=\"NumberWhole\" Accuracy=\"0\" />"
        }
      ]
    },
    {
      "name": "Description",
      "dataType": "string",
      "sourceColumn": "Description",
      "lineageTag": "43fa9d18-c6c1-4483-8b43-72b77baae1c4",
      "summarizeBy": "none",
      "annotations": [
        {
          "name": "SummarizationSetBy",
          "value": "Automatic"
        },
        {
          "name": "Format",
          "value": "<Format Format=\"Text\" />"
        }
      ]
    },
    {
      "name": "Category",
      "dataType": "string",
      "sourceColumn": "Category",
      "lineageTag": "3fe86ed7-2b53-4f11-824e-446ff0280615",
      "summarizeBy": "none",
      "annotations": [
        {
          "name": "SummarizationSetBy",
          "value": "Automatic"
        },
        {
          "name": "Format",
          "value": "<Format Format=\"Text\" />"
        }
      ]
    }
  ],
  "partitions": [
    {
      "name": "dbth AttendanceDisposal-193a7b72-b2cf-43e6-b05a-db522c7d7162",
      "mode": "import",
      "source": {
        "type": "m",
        "expression": "{ref: PartitionExpressions\\dbth AttendanceDisposal-193a7b72-b2cf-43e6-b05a-db522c7d7162.m}"
      }
    }
  ],
  "annotations": [
    {
      "name": "PBI_ResultType",
      "value": "Table"
    }
  ]
}