{
  "name": "dbth AdministrativeCategory",
  "lineageTag": "429df64e-b1ec-4fa8-b661-c176f99707e4",
  "columns": [
    {
      "name": "Code",
      "dataType": "int64",
      "sourceColumn": "Code",
      "formatString": "0",
      "lineageTag": "286e62c5-83d2-4c8a-8439-46694e2a6242",
      "summarizeBy": "none",
      "annotations": [
        {
          "name": "SummarizationSetBy",
          "value": "Automatic"
        },
        {
          "name": "Format",
          "value": "<Format Format=\"NumberWhole\" Accuracy=\"0\" />"
        },
        {
          "name": "DataTypeAtRefresh",
          "value": "Int64#####not a type"
        },
        {
          "name": "PBI_NameAtRefresh",
          "value": "Code"
        },
        {
          "name": "PBI_WasHiddenAtRefresh",
          "value": "False"
        }
      ]
    },
    {
      "name": "Description",
      "dataType": "string",
      "sourceColumn": "Description",
      "lineageTag": "6e454be6-10e2-409b-8a3b-83c414a8f847",
      "summarizeBy": "none",
      "annotations": [
        {
          "name": "SummarizationSetBy",
          "value": "Automatic"
        },
        {
          "name": "Format",
          "value": "<Format Format=\"Text\" />"
        },
        {
          "name": "DataTypeAtRefresh",
          "value": "String#####not a type"
        },
        {
          "name": "PBI_NameAtRefresh",
          "value": "Description"
        },
        {
          "name": "PBI_WasHiddenAtRefresh",
          "value": "False"
        }
      ]
    }
  ],
  "partitions": [
    {
      "name": "dbth AdministrativeCategory-8a5182be-646a-498d-8c73-c54d480fbd54",
      "mode": "import",
      "source": {
        "type": "m",
        "expression": "{ref: PartitionExpressions\\dbth AdministrativeCategory-8a5182be-646a-498d-8c73-c54d480fbd54.m}"
      }
    }
  ],
  "annotations": [
    {
      "name": "PBI_DescriptionAtRefresh"
    },
    {
      "name": "PBI_ResultType",
      "value": "Table"
    }
  ]
}