{
  "name": "dbth AdmissionMethod",
  "lineageTag": "a0393f85-ae1c-4c52-b112-fb3161a26872",
  "columns": [
    {
      "name": "Code",
      "dataType": "string",
      "sourceColumn": "Code",
      "lineageTag": "1db13c25-9d07-4c31-bc55-9ec8b8e55553",
      "summarizeBy": "none",
      "annotations": [
        {
          "name": "SummarizationSetBy",
          "value": "Automatic"
        },
        {
          "name": "Format",
          "value": "<Format Format=\"Text\" />"
        },
        {
          "name": "DataTypeAtRefresh",
          "value": "String#####not a type"
        },
        {
          "name": "PBI_NameAtRefresh",
          "value": "Code"
        },
        {
          "name": "PBI_WasHiddenAtRefresh",
          "value": "False"
        }
      ]
    },
    {
      "name": "Description",
      "dataType": "string",
      "sourceColumn": "Description",
      "lineageTag": "ecfff809-fb54-4d29-b04a-9128f66a2f14",
      "summarizeBy": "none",
      "annotations": [
        {
          "name": "SummarizationSetBy",
          "value": "Automatic"
        },
        {
          "name": "Format",
          "value": "<Format Format=\"Text\" />"
        },
        {
          "name": "DataTypeAtRefresh",
          "value": "String#####not a type"
        },
        {
          "name": "PBI_NameAtRefresh",
          "value": "Description"
        },
        {
          "name": "PBI_WasHiddenAtRefresh",
          "value": "False"
        }
      ]
    }
  ],
  "partitions": [
    {
      "name": "dbth AdmissionMethod-0ed87f57-2c09-4fa0-8438-f3aca16f4fbd",
      "mode": "import",
      "source": {
        "type": "m",
        "expression": "{ref: PartitionExpressions\\dbth AdmissionMethod-0ed87f57-2c09-4fa0-8438-f3aca16f4fbd.m}"
      }
    }
  ],
  "annotations": [
    {
      "name": "PBI_DescriptionAtRefresh"
    },
    {
      "name": "PBI_ResultType",
      "value": "Table"
    }
  ]
}