{
  "name": "dbth HospitalSite",
  "lineageTag": "d0c80c41-cd3b-4cdc-ba63-7dcd794b5d15",
  "columns": [
    {
      "name": "Code",
      "dataType": "string",
      "sourceColumn": "Code",
      "lineageTag": "8978e92c-9769-4aea-a875-b65ea112f03e",
      "summarizeBy": "none",
      "annotations": [
        {
          "name": "SummarizationSetBy",
          "value": "Automatic"
        },
        {
          "name": "Format",
          "value": "<Format Format=\"Text\" />"
        }
      ]
    },
    {
      "name": "Name",
      "dataType": "string",
      "sourceColumn": "Name",
      "lineageTag": "27fea52a-282d-4adb-a6a5-4caf5c8cc022",
      "summarizeBy": "none",
      "annotations": [
        {
          "name": "SummarizationSetBy",
          "value": "Automatic"
        },
        {
          "name": "Format",
          "value": "<Format Format=\"Text\" />"
        }
      ]
    }
  ],
  "partitions": [
    {
      "name": "dbth HospitalSite-625fbd8a-3664-42cc-bd5a-4e299a0f5e39",
      "mode": "import",
      "source": {
        "type": "m",
        "expression": "{ref: PartitionExpressions\\dbth HospitalSite-625fbd8a-3664-42cc-bd5a-4e299a0f5e39.m}"
      }
    }
  ],
  "annotations": [
    {
      "name": "PBI_ResultType",
      "value": "Table"
    }
  ]
}